{
  "$schema": "https://json-schema.org/draft/2020-12/schema",
  "$id": "https://talent-signal.local/evals/v2/schemas/profile.schema.json",
  "title": "EvaluationExecutionProfileV1",
  "type": "object",
  "additionalProperties": false,
  "required": ["schemaVersion", "profileId", "version", "contentDigest", "mode", "systemUnderTest", "frozenDependencies", "liveDependencies", "clock", "idGenerator", "timer", "budgets", "reporters"],
  "properties": {
    "schemaVersion": { "const": "evaluation-profile.v1" },
    "profileId": { "type": "string", "pattern": "^[a-z0-9-]+$" },
    "version": { "type": "string", "minLength": 1 },
    "contentDigest": { "$ref": "#/$defs/digest" },
    "mode": { "enum": ["control_plane_replay", "model_replay", "integration_probe"] },
    "systemUnderTest": { "type": "array", "minItems": 1, "uniqueItems": true, "items": { "$ref": "#/$defs/component" } },
    "frozenDependencies": {
      "type": "array",
      "items": {
        "type": "object", "additionalProperties": false,
        "required": ["bindingId", "component", "fixture", "reason"],
        "properties": { "bindingId": { "type": "string" }, "component": { "$ref": "#/$defs/component" }, "fixture": { "$ref": "#/$defs/ref" }, "reason": { "type": "string", "minLength": 6 } }
      }
    },
    "liveDependencies": {
      "type": "array",
      "items": {
        "type": "object", "additionalProperties": false,
        "required": ["bindingId", "component", "implementation", "reason"],
        "properties": { "bindingId": { "type": "string" }, "component": { "$ref": "#/$defs/component" }, "implementation": { "$ref": "#/$defs/identity" }, "reason": { "type": "string", "minLength": 6 } }
      }
    },
    "clock": { "$ref": "#/$defs/clock" },
    "idGenerator": { "$ref": "#/$defs/idGenerator" },
    "timer": { "$ref": "#/$defs/timer" },
    "budgets": {
      "type": "object", "additionalProperties": false,
      "required": ["maximumSteps", "maximumToolCalls", "maximumDurationMs", "maximumRetries"],
      "properties": { "maximumSteps": { "type": "integer", "minimum": 1 }, "maximumToolCalls": { "type": "integer", "minimum": 0 }, "maximumDurationMs": { "type": "integer", "minimum": 1 }, "maximumRetries": { "type": "integer", "minimum": 0 } }
    },
    "reporters": {
      "type": "array", "minItems": 1,
      "items": {
        "type": "object", "additionalProperties": false,
        "required": ["reporterId", "version", "destination", "contentDigest", "required"],
        "properties": { "reporterId": { "type": "string" }, "version": { "type": "string" }, "destination": { "enum": ["local", "opik", "other"] }, "contentDigest": { "$ref": "#/$defs/digest" }, "required": { "type": "boolean" } }
      }
    }
  },
  "$defs": {
    "digest": { "type": "string", "pattern": "^sha256:[a-f0-9]{64}$" },
    "component": { "enum": ["capture", "perception", "identity", "memory", "agent_policy", "model", "search", "effect_adapter"] },
    "ref": {
      "type": "object", "additionalProperties": false, "required": ["fixtureId", "path", "contentDigest"],
      "properties": { "fixtureId": { "type": "string" }, "path": { "type": "string", "pattern": "^(?!/)(?!.*(?:^|/)\\.\\.(?:/|$))[A-Za-z0-9._/-]+$" }, "contentDigest": { "$ref": "#/$defs/digest" } }
    },
    "identity": {
      "type": "object", "additionalProperties": false, "required": ["identityId", "version", "contentDigest"],
      "properties": { "identityId": { "type": "string" }, "version": { "type": "string" }, "contentDigest": { "$ref": "#/$defs/digest" } }
    },
    "clock": {
      "type": "object", "additionalProperties": false, "required": ["bindingId", "mode", "version", "contentDigest"],
      "properties": { "bindingId": { "type": "string" }, "mode": { "enum": ["system", "frozen", "controlled"] }, "version": { "type": "string" }, "contentDigest": { "$ref": "#/$defs/digest" } }
    },
    "idGenerator": {
      "type": "object", "additionalProperties": false, "required": ["bindingId", "mode", "version", "contentDigest"],
      "properties": { "bindingId": { "type": "string" }, "mode": { "enum": ["system", "deterministic"] }, "version": { "type": "string" }, "contentDigest": { "$ref": "#/$defs/digest" } }
    },
    "timer": {
      "type": "object", "additionalProperties": false, "required": ["bindingId", "mode", "version", "contentDigest"],
      "properties": { "bindingId": { "type": "string" }, "mode": { "enum": ["system", "controlled"] }, "version": { "type": "string" }, "contentDigest": { "$ref": "#/$defs/digest" } }
    }
  }
}
