{
  "schemaVersion": "evaluation-profile.v1",
  "contentDigest": "sha256:aaf096ad4e60922f6fa26d5d99a52c185898279bb9a70f5bb3254f7eea64280b",
  "profileId": "memory-replay-v1",
  "version": "1",
  "mode": "control_plane_replay",
  "systemUnderTest": [
    "memory"
  ],
  "frozenDependencies": [
    {
      "bindingId": "identity-reviewed",
      "component": "identity",
      "fixture": {
        "fixtureId": "dependency:confirmed-identity:r1",
        "path": "evals/v2/fixtures/runtime/confirmed-identity.json",
        "contentDigest": "sha256:6d6a7b2daf115767fd0ca297e7758bc74357d6369862f6bf7e594e8f0c0d8e20"
      },
      "reason": "Identity is reviewed before temporal memory behavior is tested."
    },
    {
      "bindingId": "provider-scripted",
      "component": "model",
      "fixture": {
        "fixtureId": "dependency:scripted-provider:r1",
        "path": "evals/v2/fixtures/runtime/scripted-provider.json",
        "contentDigest": "sha256:86d792707dbbb722a8daef5890644dd6b63121437ba27cec248c3978d197156c"
      },
      "reason": "A deterministic provider isolates canonical memory transition behavior."
    }
  ],
  "liveDependencies": [],
  "clock": {
    "bindingId": "clock-frozen-v1",
    "mode": "frozen",
    "version": "1",
    "contentDigest": "sha256:7cf6fc03e8395feb429083e7135f36486c57c08d02f30c7d4a45c7db3eee8ffc"
  },
  "idGenerator": {
    "bindingId": "id-deterministic-v1",
    "mode": "deterministic",
    "version": "1",
    "contentDigest": "sha256:f79283d7b710f163008cc368c95bb74b1255a5f3391d2bf4c9634d9d0810957e"
  },
  "timer": {
    "bindingId": "timer-controlled-v1",
    "mode": "controlled",
    "version": "1",
    "contentDigest": "sha256:17663d5342e33f2275d05bdd880483ff0db4c9c3c077ab8f742f47506acc348a"
  },
  "budgets": {
    "maximumSteps": 6,
    "maximumToolCalls": 0,
    "maximumDurationMs": 5000,
    "maximumRetries": 0
  },
  "reporters": [
    {
      "reporterId": "local-json",
      "version": "1",
      "destination": "local",
      "contentDigest": "sha256:a8668a29920ac8e7370cfbc82cf3d2a923182c4e7eb99bb3c9168d480a122558",
      "required": true
    },
    {
      "reporterId": "opik",
      "version": "1",
      "destination": "opik",
      "contentDigest": "sha256:2d1afc8496efb7f951ad00c1387b3c7a45f5b7027e8fd073377d14420324cd33",
      "required": false
    }
  ]
}
